Paper_ID,step_0_visual_inspection,step_1_concept_analysis,step_2_benchmark_verification,step_3_strategic_critique
O_ISAC_001,The provided figures show the performance evaluation of the VLC CE-OFDM system. Figure 1 presents th...,"The system mechanism is based on CE-OFDM, which is a waveform that mitigates nonlinearities and enha...","The reported metrics, such as EVM and PSD, are physically consistent with the hardware and system pa...",The solved problems include the mitigation of nonlinearities and the enhancement of performance unde...
O_ISAC_002,"The provided images include diagrams of different types of waveforms, a process of producing a new p...",The system mechanism involves photonic terahertz integrated sensing and communication (ISAC) systems...,"The reported metrics include a data transmission rate of 6 Gbit/s over a 1-meter wireless link, a ra...",The solved problems include the development of a radar-centric photonic terahertz integrated sensing...
O_ISAC_003,"The paper includes several diagrams and charts, including a car with a target and a target on the ro...",The system mechanism involves the use of visible light communication (VLC) for integrated sensing an...,"The paper reports on the simulation results of the channel characteristics, including the path loss,...",The paper solves the problem of characterizing the visible light-based ISAC channel in a V2V scenari...
O_ISAC_004,"The paper includes several figures, including a diagram of the proposed system for integrated optica...",The proposed system integrates optical fiber sensing and telecommunication using an adiabatic-tapere...,The paper reports a salinity sensitivity of 0.1 nm/‰ at a wavelength of 1550 nm for seawater monitor...,"The proposed system solves the problem of integrating optical fiber sensing and telecommunication, e..."
O_ISAC_005,"The paper includes several figures and charts, including Fig. 1, which shows the proposed ISAC syste...","The system mechanism involves a UAV-aided mixed FSO-RF network, where the UAV uses FSO for backhaul ...","The paper reports various metrics, including the end-to-end UAV throughput and total edge users thro...",The paper solves the problem of optimizing the UAV's trajectory to maximize the end-to-end network t...
